<!ELEMENT personne (nom , prenom , dateNaissane ,ville,sexe,enfants)>
<!ELEMENT nom (#PCDATA)>
<!ELEMENT prenom (#PCDATA)>
<!ELEMENT  dateNaissane  (#PCDATA)>
<!ELEMENT ville (#PCDATA)>
<!ELEMENT sexe (#PCDATA)>
<!ELEMENT enfants (nom_complet+)>
<!ELEMENT nom_complet (#PCDATA)>